{
  "$schema": "../../templates/enums.schema.json",
  "schemaVersion": 1,
  "kind": "enums",
  "enums": {
    "action_class": {
      "alias": "Action classes",
      "kind": "defines",
      "prefix": "SYS_ACTIONS_CLASS_",
      "source_file": "components/sys/sys_actions/sys_actions.h",
      "members": [
        {
          "name": "SYS_ACTIONS_CLASS_USER",
          "value": 0,
          "alias": "Action",
          "description": "the app's own actions"
        },
        {
          "name": "SYS_ACTIONS_CLASS_SYSTEM",
          "value": 1,
          "alias": "Settings",
          "description": "settings of the system modules"
        },
        {
          "name": "SYS_ACTIONS_CLASS_DEVICE",
          "value": 2,
          "alias": "Device",
          "description": "install and default commands"
        },
        {
          "name": "SYS_ACTIONS_CLASS_PROJECT",
          "value": 3,
          "alias": "Project",
          "description": "stored project run list and sections"
        }
      ]
    },
    "ble_frag": {
      "alias": "Fragment header",
      "kind": "defines",
      "prefix": "SYS_BLE_FRAG_",
      "source_file": "components/sys/sys_ble/sys_ble.h",
      "members": [
        {
          "name": "SYS_BLE_FRAG_LAST",
          "value": 128,
          "alias": "Last packet",
          "description": "Bit 7: the last packet of a frame"
        },
        {
          "name": "SYS_BLE_FRAG_FIRST",
          "value": 64,
          "alias": "First packet",
          "description": "Bit 6: the first packet of a frame; the counter restarts at 0"
        },
        {
          "name": "SYS_BLE_FRAG_COUNT_MASK",
          "value": 63,
          "alias": "Packet counter mask",
          "description": "Bits 0-5: the packet counter, modulo 64"
        }
      ]
    },
    "ble_runit_uuid": {
      "alias": "runIT GATT UUIDs",
      "kind": "defines",
      "prefix": "SYS_BLE_",
      "source_file": "components/sys/sys_ble/sys_ble.h",
      "members": [
        {
          "name": "SYS_BLE_SVC_RUNIT",
          "value": 65504,
          "alias": "runIT service",
          "description": "The primary service that carries the router link and the streams"
        },
        {
          "name": "SYS_BLE_CHR_RUNIT_TX",
          "value": 65505,
          "alias": "Answers and telemetry",
          "description": "Notify, framed: router answers, the telemetry and events streams"
        },
        {
          "name": "SYS_BLE_CHR_RUNIT_RX",
          "value": 65506,
          "alias": "Requests",
          "description": "Write, framed: router requests"
        },
        {
          "name": "SYS_BLE_CHR_RUNIT_LOGS",
          "value": 65507,
          "alias": "Logs and errors",
          "description": "Notify, framed: the logs and errors streams"
        },
        {
          "name": "SYS_BLE_CHT_RUNIT_STATUS",
          "value": 65508,
          "alias": "Status",
          "description": "Notify, unframed: created, nothing sends on it yet"
        }
      ]
    },
    "board_device": {
      "alias": "Board devices",
      "kind": "defines",
      "prefix": "DEVICE_ID_",
      "source_file": "components/app/runit/runit_board_defs.h",
      "members": [
        {
          "name": "DEVICE_ID_GPIO_ESP",
          "value": 0,
          "alias": "ESP32 GPIO",
          "description": "the ESP32-S3's own pins"
        },
        {
          "name": "DEVICE_ID_TCA6424A",
          "value": 1,
          "alias": "GPIO expander",
          "description": "TCA6424A, 24 pins (LEDs, interrupts, enables)"
        },
        {
          "name": "DEVICE_ID_ADS7128",
          "value": 2,
          "alias": "ADC",
          "description": "ADS7128, 8 inputs scaled to 20 V"
        },
        {
          "name": "DEVICE_ID_PCA9685",
          "value": 3,
          "alias": "PWM expander",
          "description": "PCA9685 (servo headers CH 0..7, DRV8962 #2 on CH 8..15)"
        },
        {
          "name": "DEVICE_ID_DAC53202",
          "value": 4,
          "alias": "DAC",
          "description": "DAC53202 (OUT0 / OUT1 = VREF of DRV8962 #1 / #2)"
        },
        {
          "name": "DEVICE_ID_DRV8962_0",
          "value": 5,
          "alias": "Motor driver 1",
          "description": "DRV8962 #1 (IN / EN / IPROPI on ESP)"
        },
        {
          "name": "DEVICE_ID_DRV8962_1",
          "value": 6,
          "alias": "Motor driver 2",
          "description": "DRV8962 #2 (IN / EN on PCA9685 CH 8..15)"
        },
        {
          "name": "DEVICE_ID_SUPPLY_DRV8962_0",
          "value": 7,
          "alias": "Motor 1 supply",
          "description": "Power mux of driver 1 (A = board input, B = rail B)"
        },
        {
          "name": "DEVICE_ID_SUPPLY_DRV8962_1",
          "value": 8,
          "alias": "Motor 2 supply",
          "description": "Power mux of driver 2 (A = board input, B = rail A)"
        },
        {
          "name": "DEVICE_ID_TPS55289_2",
          "value": 10,
          "alias": "Rail A",
          "description": "TPS55289 buck-boost regulator at 0x74"
        },
        {
          "name": "DEVICE_ID_TPS55289_1",
          "value": 11,
          "alias": "Rail B",
          "description": "TPS55289 buck-boost regulator at 0x75"
        },
        {
          "name": "DEVICE_ID_INA3221",
          "value": 12,
          "alias": "Power monitor",
          "description": "INA3221 (the board input and both rails)"
        },
        {
          "name": "DEVICE_ID_AP33772S",
          "value": 13,
          "alias": "USB-C PD",
          "description": "AP33772S USB-C power delivery sink"
        }
      ]
    },
    "device_contract": {
      "alias": "Device Contract",
      "kind": "defines",
      "prefix": "SYS_DEVICE_CONTRACT_",
      "source_file": "components/sys/sys_device/sys_device.h",
      "members": [
        {
          "name": "SYS_DEVICE_CONTRACT_DEVICE",
          "value": 0,
          "alias": "Device",
          "description": "Device lifecycle operations"
        },
        {
          "name": "SYS_DEVICE_CONTRACT_IO",
          "value": 1,
          "alias": "IO pins",
          "description": "IO pins operations"
        },
        {
          "name": "SYS_DEVICE_CONTRACT_PINS",
          "value": 2,
          "alias": "Pin locks",
          "description": "Pin locks operations"
        },
        {
          "name": "SYS_DEVICE_CONTRACT_EVENT",
          "value": 3,
          "alias": "Events",
          "description": "Events operations"
        },
        {
          "name": "SYS_DEVICE_CONTRACT_POWER_MONITOR",
          "value": 4,
          "alias": "Power monitor",
          "description": "Power monitor operations"
        },
        {
          "name": "SYS_DEVICE_CONTRACT_POWER_VREG",
          "value": 5,
          "alias": "Regulator",
          "description": "Voltage regulator operations"
        },
        {
          "name": "SYS_DEVICE_CONTRACT_POWER_MANAGER",
          "value": 6,
          "alias": "Power manager events",
          "description": "Power manager operations"
        },
        {
          "name": "SYS_DEVICE_CONTRACT_POWER_USB_PD",
          "value": 7,
          "alias": "USB-PD sink",
          "description": "USB-PD sink operations"
        },
        {
          "name": "SYS_DEVICE_CONTRACT_POWER_SUPPLY",
          "value": 8,
          "alias": "Power mux",
          "description": "Power supply/mux operations"
        },
        {
          "name": "SYS_DEVICE_CONTRACT_HBRIDGE",
          "value": 9,
          "alias": "H-bridge",
          "description": "H-bridge motor driver operations"
        },
        {
          "name": "SYS_DEVICE_CONTRACT_OWN",
          "value": 255,
          "alias": "Device-specific",
          "description": "Device-specific own operations"
        }
      ]
    },
    "drv8962_topology_e": {
      "alias": "DRV8962 Topology",
      "kind": "enum",
      "source_file": "components/devices/device_drv8962/device_drv8962.h",
      "members": [
        {
          "name": "DRV8962_TOPOLOGY_2_FULL_BRIDGES",
          "value": 0,
          "alias": "Two full bridges",
          "description": "Two full bridges: ch0 (OUT1+OUT2), ch1 (OUT3+OUT4)"
        },
        {
          "name": "DRV8962_TOPOLOGY_4_HALF_BRIDGES",
          "value": 1,
          "alias": "Four half bridges",
          "description": "Four half bridges: ch0..ch3 (OUT1..OUT4)"
        }
      ]
    },
    "err_sev_e": {
      "alias": "Error Severity",
      "kind": "enum",
      "source_file": "components/core/errors/errors.h",
      "members": [
        {
          "name": "ERR_SEV_NONE",
          "value": 0,
          "alias": "None",
          "description": "No severity: context only (a route, a request)"
        },
        {
          "name": "ERR_SEV_LOW",
          "value": 1,
          "alias": "Low",
          "description": "Noteworthy; nothing needs to stop"
        },
        {
          "name": "ERR_SEV_MEDIUM",
          "value": 2,
          "alias": "Medium",
          "description": "Something failed and a feature may not work"
        },
        {
          "name": "ERR_SEV_HIGH",
          "value": 3,
          "alias": "High",
          "description": "A significant failure; the board may need attention"
        },
        {
          "name": "ERR_SEV_CRITICAL",
          "value": 4,
          "alias": "Critical",
          "description": "The board must be made safe"
        },
        {
          "name": "ERR_SEV_DEFAULT",
          "value": 255,
          "alias": "Tag default",
          "description": "The severity the error's tag declares"
        }
      ]
    },
    "router_err_flag": {
      "alias": "Error Record Flags",
      "kind": "defines",
      "prefix": "ROUTER_ERR_",
      "source_file": "components/core/router/router.h",
      "members": [
        {
          "name": "ROUTER_ERR_REQ_CUT",
          "value": 128,
          "alias": "Request cut",